id,name,lng,lat,address,city,province,count,full_address
2412,金家畈湾,114.635849,30.02564,金家畈湾,黄石市,湖北省,2,湖北省黄石市大冶市金牛镇金畈村金家畈湾
2413,大屋涂湾,114.561127,30.012239,大屋涂湾,黄石市,湖北省,1,湖北省黄石市大冶市金牛镇高河村大屋涂湾
2414,孙家湾,114.557129,30.00765,孙家湾,黄石市,湖北省,1,湖北省黄石市大冶市金牛镇高河村孙家湾
2415,细屋涂湾,114.557129,30.00765,细屋涂湾,黄石市,湖北省,1,湖北省黄石市大冶市金牛镇高河村细屋涂湾
2416,余洪湾,114.774178,30.03476,余洪湾,黄石市,湖北省,1,湖北省黄石市大冶市陈贵镇余洪村余洪湾
2417,下罗柯湾,114.780586,29.999331,下罗柯湾,黄石市,湖北省,2,湖北省黄石市大冶市陈贵镇刘家畈村下罗柯湾
2418,杨庚湾,114.861671,30.070761,杨庚湾,黄石市,湖北省,1,湖北省黄石市大冶市陈贵镇官堂垴村杨庚湾
2419,咸春湾,114.818588,30.028481,咸春湾,黄石市,湖北省,2,湖北省黄石市大冶市陈贵镇小雷山村咸春湾
2420,李河湾6组,114.843384,30.083401,李河湾6组,黄石市,湖北省,2,湖北省黄石市大冶市陈贵镇李河村李河湾6组
2421,吴灿庭湾,114.807419,30.05266,吴灿庭湾,黄石市,湖北省,1,湖北省黄石市大冶市陈贵镇江添受村吴灿庭湾
2422,黄蒋叶陈小区,114.967194,30.113462,黄蒋叶陈小区,黄石市,湖北省,1,湖北省黄石市大冶市高新区七里界村黄蒋叶陈小区
2423,上冯湾西小区,114.972809,30.117966,上冯湾西小区,黄石市,湖北省,1,湖北省黄石市大冶市高新区下冯村上冯湾西小区
2424,上冯路5号10栋,114.97324,30.11886,上冯路5号10栋,黄石市,湖北省,1,湖北省黄石市大冶市高新区下冯村上冯路5号10栋
2425,下冯小区,114.974403,30.108269,下冯小区,黄石市,湖北省,1,湖北省黄石市大冶市高新区下冯村下冯小区
2426,冯锦文小区,114.971199,30.113398,冯锦文小区,黄石市,湖北省,1,湖北省黄石市大冶市高新区下冯村冯锦文小区
2427,吴家庄小区,114.972374,30.104763,吴家庄小区,黄石市,湖北省,1,湖北省黄石市大冶市高新区下冯村吴家庄小区
2428,周家湾,114.894897,30.035561,周家湾,黄石市,湖北省,1,湖北省黄石市大冶市高新区下冯村周家湾
2429,黄世升3号楼,114.973648,30.10277,黄世升3号楼,黄石市,湖北省,1,湖北省黄石市大冶市高新区下冯村黄世升3号楼
2430,於家湾小区,114.963707,30.09861,於家湾小区,黄石市,湖北省,1,湖北省黄石市大冶市高新区下黄村於家湾小区
2431,湖景花园6栋,114.976753,30.118731,湖景花园6栋,黄石市,湖北省,2,湖北省黄石市大冶市高新区东鑫社区湖景花园6栋
2432,荟萃北路57号,114.96868,30.10042,荟萃北路57号,黄石市,湖北省,1,湖北省黄石市大冶市高新区东风社区荟萃北路57号
2433,三期还建楼6栋,114.969254,30.119921,三期还建楼6栋,黄石市,湖北省,1,湖北省黄石市大冶市高新区向阳社区三期还建楼6栋
2434,怡景花园2栋,114.974297,30.11854,怡景花园2栋,黄石市,湖北省,1,湖北省黄石市大冶市高新区向阳社区怡景花园2栋
2435,怡景花园4栋,114.974297,30.11854,怡景花园4栋,黄石市,湖北省,1,湖北省黄石市大冶市高新区向阳社区怡景花园4栋
2436,怡景花园C栋,114.974297,30.11854,怡景花园C栋,黄石市,湖北省,1,湖北省黄石市大冶市高新区向阳社区怡景花园C栋
2437,嘉禾华府4栋,114.968452,30.103331,嘉禾华府4栋,黄石市,湖北省,4,湖北省黄石市大冶市高新区康乐社区嘉禾华府4栋
2438,阳光新都1栋,114.96537,30.10289,阳光新都1栋,黄石市,湖北省,1,湖北省黄石市大冶市高新区康乐社区阳光新都1栋
2439,阳光新都4栋,114.96537,30.10289,阳光新都4栋,黄石市,湖北省,1,湖北省黄石市大冶市高新区康乐社区阳光新都4栋
2440,下张湾,114.905586,30.135,下张湾,黄石市,湖北省,2,湖北省黄石市大冶市高新区新建村下张湾
2441,国源村3栋,114.97596,30.100653,国源村3栋,黄石市,湖北省,1,湖北省黄石市大冶市高新区朝阳社区国源村3栋
2442,柯家渡湾,114.928436,30.098169,柯家渡湾,黄石市,湖北省,1,湖北省黄石市大冶市高新区桃花村柯家渡湾
2443,上程湾,114.976151,30.143301,上程湾,黄石市,湖北省,1,湖北省黄石市大冶市高新区港湖村上程湾
2444,还建楼17栋,115.044922,30.138378,还建楼17栋,黄石市,湖北省,1,湖北省黄石市大冶市高新区港湖村还建楼17栋
2445,金港小区10栋,114.945801,30.157921,金港小区10栋,黄石市,湖北省,1,湖北省黄石市大冶市高新区王家庄村金港小区10栋
2446,嘉禾国际3栋,114.964951,30.104589,嘉禾国际3栋,黄石市,湖北省,1,湖北省黄石市大冶市高新区观山花园社区嘉禾国际3栋
2447,彩虹大厦,114.832977,30.20808,彩虹大厦,黄石市,湖北省,1,湖北省黄石市大冶市高新区观山花园社区彩虹大厦
2448,甘家湾小区,114.969933,30.100931,甘家湾小区,黄石市,湖北省,3,湖北省黄石市大冶市高新区观山花园社区甘家湾小区
2449,蔚蓝港湾7栋,114.980873,30.111509,蔚蓝港湾7栋,黄石市,湖北省,2,湖北省黄石市大冶市高新区铜草花园社区蔚蓝港湾7栋
2450,铜草花园6栋,114.9767,30.111549,铜草花园6栋,黄石市,湖北省,2,湖北省黄石市大冶市高新区铜草花园社区铜草花园6栋
2451,圆梦国际2栋,114.980301,30.121889,圆梦国际2栋,黄石市,湖北省,1,湖北省黄石市大冶市高新区长安社区圆梦国际2栋
2452,丛树林湾,114.970947,30.067741,丛树林湾,黄石市,湖北省,1,湖北省黄石市大冶市高新区青松村丛树林湾
2453,云顶花园,114.978622,30.10462,云顶花园,黄石市,湖北省,1,湖北省黄石市大冶市高新区风华社区云顶花园
2454,凤凰小区3栋,114.981483,30.107189,凤凰小区3栋,黄石市,湖北省,1,湖北省黄石市大冶市高新区风华社区凤凰小区3栋
2455,化工厂小区,114.973221,30.102961,化工厂小区,黄石市,湖北省,1,湖北省黄石市大冶市高新区馨园社区化工厂小区
2456,开发区家属楼,114.973221,30.102961,开发区家属楼,黄石市,湖北省,1,湖北省黄石市大冶市高新区馨园社区开发区家属楼
2457,老社保局宿舍2栋,114.975998,30.09288,老社保局宿舍2栋,黄石市,湖北省,2,湖北省黄石市大冶市高新区馨园社区老社保局宿舍2栋
2458,,115.072853,30.058849,下海村,黄石市,湖北省,1,湖北省黄石市开发区铁山区大王镇下海村
2459,,115.067932,30.075211,八祥村,黄石市,湖北省,1,湖北省黄石市开发区铁山区大王镇八祥村
2460,,115.04763,30.138519,金山街道,黄石市,湖北省,1,湖北省黄石市开发区铁山区大王镇大路村金山街道
2461,,115.011543,30.113461,金山街道,黄石市,湖北省,1,湖北省黄石市开发区铁山区大王镇新农村金山街道
2462,,115.141167,30.058729,江垅村,黄石市,湖北省,1,湖北省黄石市开发区铁山区大王镇江垅村
2463,,115.028381,30.140169,金山街道,黄石市,湖北省,1,湖北省黄石市开发区铁山区大王镇王坛村金山街道
2464,,115.085159,30.07037,贵湾村,黄石市,湖北省,1,湖北省黄石市开发区铁山区大王镇贵湾村
2465,,115.048866,30.15346,金山街道,黄石市,湖北省,1,湖北省黄石市开发区铁山区大王镇路平村金山街道
2466,,115.063332,30.08297,金寨村,黄石市,湖北省,1,湖北省黄石市开发区铁山区大王镇金寨村
2467,,114.90143,30.20666,章山街办,黄石市,湖北省,1,湖北省黄石市开发区铁山区大王镇龙山村章山街办
2468,,114.90143,30.20666,章山街办,黄石市,湖北省,1,湖北省黄石市开发区铁山区大王镇龙泉村章山街办
2469,,115.165047,30.051319,世英村,黄石市,湖北省,1,湖北省黄石市开发区铁山区太子镇世英村
2470,,115.220192,30.0201,张畈村,黄石市,湖北省,1,湖北省黄石市开发区铁山区太子镇张畈村
2471,,115.207542,30.035259,朋畈村,黄石市,湖北省,1,湖北省黄石市开发区铁山区太子镇朋畈村
2472,,115.099319,30.16033,四连山村,黄石市,湖北省,2,湖北省黄石市开发区铁山区汪仁镇四连山村
2473,,115.078491,30.13863,庆洪村,黄石市,湖北省,1,湖北省黄石市开发区铁山区汪仁镇庆洪村
2474,,115.117073,30.13241,枯树咀村,黄石市,湖北省,1,湖北省黄石市开发区铁山区汪仁镇枯树咀村
2475,,115.131149,30.15526,汪仁村,黄石市,湖北省,1,湖北省黄石市开发区铁山区汪仁镇汪仁村
2476,,115.131241,30.133289,王贵村,黄石市,湖北省,1,湖北省黄石市开发区铁山区汪仁镇王贵村
2477,,115.064522,30.143921,百花村,黄石市,湖北省,3,湖北省黄石市开发区铁山区汪仁镇百花村
2478,,115.124687,30.14662,竹林湾村,黄石市,湖北省,1,湖北省黄石市开发区铁山区汪仁镇竹林湾村
2479,九龙洞社区,114.898956,30.21063,九龙洞社区,黄石市,湖北省,6,湖北省黄石市开发区铁山区铁山街道九龙洞社区
2480,冶矿路社区,114.9021,30.202829,冶矿路社区,黄石市,湖北省,2,湖北省黄石市开发区铁山区铁山街道冶矿路社区
2481,友爱街社区,114.898628,30.20714,友爱街社区,黄石市,湖北省,8,湖北省黄石市开发区铁山区铁山街道友爱街社区
2482,建设路社区,114.901237,30.210409,建设路社区,黄石市,湖北省,5,湖北省黄石市开发区铁山区铁山街道建设路社区
2483,新村社区,114.894089,30.201975,新村社区,黄石市,湖北省,3,湖北省黄石市开发区铁山区铁山街道新村社区
2484,曹家林社区,114.902504,30.200756,曹家林社区,黄石市,湖北省,2,湖北省黄石市开发区铁山区铁山街道曹家林社区
2485,盛洪卿社区,114.90831,30.20125,盛洪卿社区,黄石市,湖北省,5,湖北省黄石市开发区铁山区铁山街道盛洪卿社区
2486,矿山路社区,114.90831,30.20125,矿山路社区,黄石市,湖北省,5,湖北省黄石市开发区铁山区铁山街道矿山路社区
2487,胜利路社区,114.905663,30.203529,胜利路社区,黄石市,湖北省,4,湖北省黄石市开发区铁山区铁山街道胜利路社区
2488,铜鼓地社区,114.901588,30.19713,铜鼓地社区,黄石市,湖北省,1,湖北省黄石市开发区铁山区铁山街道铜鼓地社区
2489,江北社区,115.090286,30.21678,江北社区,黄石市,湖北省,2,湖北省黄石市黄石港区江北管理区江北社区
2490,亚光社区,115.080528,30.212797,亚光社区,黄石市,湖北省,3,湖北省黄石市黄石港区沈家营街道亚光社区
2491,凤凰山社区,115.055611,30.22183,凤凰山社区,黄石市,湖北省,5,湖北省黄石市黄石港区沈家营街道凤凰山社区
2492,南岳社区,115.070061,30.219959,南岳社区,黄石市,湖北省,4,湖北省黄石市黄石港区沈家营街道南岳社区
2493,市建村社区,115.07531,30.22728,市建村社区,黄石市,湖北省,6,湖北省黄石市黄石港区沈家营街道市建村社区
2494,师院社区,115.069672,30.226238,师院社区,黄石市,湖北省,2,湖北省黄石市黄石港区沈家营街道师院社区
2495,桂花湾社区,115.059319,30.224649,桂花湾社区,黄石市,湖北省,7,湖北省黄石市黄石港区沈家营街道桂花湾社区
2496,楠竹林社区,115.034019,30.220568,楠竹林社区,黄石市,湖北省,4,湖北省黄石市黄石港区沈家营街道楠竹林社区
2497,沈家营社区,115.073059,30.23036,沈家营社区,黄石市,湖北省,3,湖北省黄石市黄石港区沈家营街道沈家营社区
2498,王家里社区,115.071442,30.223763,王家里社区,黄石市,湖北省,3,湖北省黄石市黄石港区沈家营街道王家里社区
2499,红旗桥社区,115.080467,30.219191,红旗桥社区,黄石市,湖北省,17,湖北省黄石市黄石港区沈家营街道红旗桥社区
2500,南京路社区,115.092651,30.212641,南京路社区,黄石市,湖北省,8,湖北省黄石市黄石港区胜阳港街道南京路社区
2501,天桥社区,115.097519,30.209766,天桥社区,黄石市,湖北省,6,湖北省黄石市黄石港区胜阳港街道天桥社区
2502,文化宫社区,115.09008,30.2136,文化宫社区,黄石市,湖北省,9,湖北省黄石市黄石港区胜阳港街道文化宫社区
2503,海观山社区,115.088028,30.217951,海观山社区,黄石市,湖北省,8,湖北省黄石市黄石港区胜阳港街道海观山社区
2504,湖滨路社区,115.083633,30.21126,湖滨路社区,黄石市,湖北省,6,湖北省黄石市黄石港区胜阳港街道湖滨路社区
2505,胜阳港社区,115.092392,30.210865,胜阳港社区,黄石市,湖北省,6,湖北省黄石市黄石港区胜阳港街道胜阳港社区
2506,钟楼社区,115.092651,30.20751,钟楼社区,黄石市,湖北省,7,湖北省黄石市黄石港区胜阳港街道钟楼社区
2507,大码头社区,115.050957,30.245998,大码头社区,黄石市,湖北省,10,湖北省黄石市黄石港区花湖街道大码头社区
2508,天方社区,115.052811,30.243731,天方社区,黄石市,湖北省,2,湖北省黄石市黄石港区花湖街道天方社区
2509,天虹社区,115.056702,30.244419,天虹社区,黄石市,湖北省,7,湖北省黄石市黄石港区花湖街道天虹社区
2510,老虎头社区,115.052811,30.243731,老虎头社区,黄石市,湖北省,5,湖北省黄石市黄石港区花湖街道老虎头社区
2511,花湖社区,115.042358,30.24316,花湖社区,黄石市,湖北省,4,湖北省黄石市黄石港区花湖街道花湖社区
2512,锁前社区,115.036026,30.243929,锁前社区,黄石市,湖北省,3,湖北省黄石市黄石港区花湖街道锁前社区
2513,万达社区,115.069344,30.239981,万达社区,黄石市,湖北省,1,湖北省黄石市黄石港区黄石港街道万达社区
2514,大桥社区,115.067017,30.24321,大桥社区,黄石市,湖北省,5,湖北省黄石市黄石港区黄石港街道大桥社区
2515,新闸社区,115.066833,30.254553,新闸社区,黄石市,湖北省,10,湖北省黄石市黄石港区黄石港街道新闸社区
2516,覆盆山社区,115.070709,30.229347,覆盆山社区,黄石市,湖北省,7,湖北省黄石市黄石港区黄石港街道覆盆山社区
2517,黄印村社区,115.056313,30.23848,黄印村社区,黄石市,湖北省,1,湖北省黄石市黄石港区黄石港街道黄印村社区
2518,黄石港社区,115.066238,30.239157,黄石港社区,黄石市,湖北省,3,湖北省黄石市黄石港区黄石港街道黄石港社区
2519,临江社区,115.106979,30.20126,临江社区,黄石市,湖北省,6,湖北省黄石市西塞山区八泉街道临江社区
2520,八泉社区,115.098175,30.205383,八泉社区,黄石市,湖北省,14,湖北省黄石市西塞山区八泉街道八泉社区
2521,和平街社区,115.098534,30.204458,和平街社区,黄石市,湖北省,1,湖北省黄石市西塞山区八泉街道和平街社区
2522,月亮山社区,115.090218,30.20356,月亮山社区,黄石市,湖北省,7,湖北省黄石市西塞山区八泉街道月亮山社区
2523,飞云社区,115.109016,30.203697,飞云社区,黄石市,湖北省,2,湖北省黄石市西塞山区八泉街道飞云社区
2524,道士袱村,115.174049,30.20859,道士袱村,黄石市,湖北省,1,湖北省黄石市西塞山区工业园区道士袱村
2525,十五冶社区,115.080338,30.198639,十五冶社区,黄石市,湖北省,1,湖北省黄石市西塞山区澄月街道十五冶社区
2526,大智路社区,115.086807,30.206869,大智路社区,黄石市,湖北省,6,湖北省黄石市西塞山区澄月街道大智路社区
2527,澄月社区,115.074829,30.203449,澄月社区,黄石市,湖北省,13,湖北省黄石市西塞山区澄月街道澄月社区
2528,磁湖社区,115.083977,30.205021,磁湖社区,黄石市,湖北省,7,湖北省黄石市西塞山区澄月街道磁湖社区
2529,陈家湾社区,115.077492,30.19426,陈家湾社区,黄石市,湖北省,3,湖北省黄石市西塞山区澄月街道陈家湾社区
2530,八卦嘴社区,115.07444,30.19825,八卦嘴社区,黄石市,湖北省,6,湖北省黄石市西塞山区牧羊湖街道八卦嘴社区
2531,牧羊湖社区,115.073189,30.194885,牧羊湖社区,黄石市,湖北省,9,湖北省黄石市西塞山区牧羊湖街道牧羊湖社区
2532,石料山社区,115.065605,30.197054,石料山社区,黄石市,湖北省,5,湖北省黄石市西塞山区牧羊湖街道石料山社区
2533,胡家湾社区,115.055679,30.18539,胡家湾社区,黄石市,湖北省,5,湖北省黄石市西塞山区牧羊湖街道胡家湾社区
2534,花园路社区,115.074654,30.19434,花园路社区,黄石市,湖北省,2,湖北省黄石市西塞山区牧羊湖街道花园路社区
2535,叶家塘社区,115.117889,30.20389,叶家塘社区,黄石市,湖北省,4,湖北省黄石市西塞山区黄思湾街道叶家塘社区
2536,新建区社区,115.237549,30.142191,新建区社区,黄石市,湖北省,1,湖北省黄石市西塞山区黄思湾街道新建区社区
2537,田园社区,115.132378,30.195921,田园社区,黄石市,湖北省,4,湖北省黄石市西塞山区黄思湾街道田园社区
2538,马家嘴社区,115.153877,30.198959,马家嘴社区,黄石市,湖北省,1,湖北省黄石市西塞山区黄思湾街道马家嘴社区
2539,黄思湾社区,115.132683,30.19483,黄思湾社区,黄石市,湖北省,7,湖北省黄石市西塞山区黄思湾街道黄思湾社区
2540,,114.951271,29.823151,三溪镇,黄石市,湖北省,4,湖北省黄石市阳新县三溪镇
2541,,115.207901,29.840851,兴国镇,黄石市,湖北省,39,湖北省黄石市阳新县兴国镇
2542,军垦农场,115.065308,29.779921,军垦农场,黄石市,湖北省,3,湖北省黄石市阳新县军垦农场
2543,,115.234062,29.869812,城东新区,黄石市,湖北省,12,湖北省黄石市阳新县城东新区
2544,,115.177742,29.866171,城北经济开发区,黄石市,湖北省,17,湖北省黄石市阳新县城北经济开发区
2545,,115.439949,29.855591,富池镇,黄石市,湖北省,1,湖北省黄石市阳新县富池镇
2546,,115.060051,29.719299,排市镇,黄石市,湖北省,2,湖北省黄石市阳新县排市镇
2547,,115.255013,29.720169,木港镇,黄石市,湖北省,7,湖北省黄石市阳新县木港镇
2548,,115.403954,29.75845,枫林镇,黄石市,湖北省,4,湖北省黄石市阳新县枫林镇
2549,,115.143738,29.57506,洋港镇,黄石市,湖北省,2,湖北省黄石市阳新县洋港镇
2550,,115.090279,29.90118,浮屠镇,黄石市,湖北省,3,湖北省黄石市阳新县浮屠镇
2551,,115.069,29.95505,白沙镇,黄石市,湖北省,13,湖北省黄石市阳新县白沙镇
2552,,115.26741,29.936609,陶港镇,黄石市,湖北省,3,湖北省黄石市阳新县陶港镇
2553,,115.24453,30.137171,韦源口镇,黄石市,湖北省,2,湖北省黄石市阳新县韦源口镇
2554,,114.957771,29.61348,龙港镇,黄石市,湖北省,22,湖北省黄石市阳新县龙港镇
2555,杭州东路社区,115.034904,30.193466,杭州东路社区,黄石市,湖北省,4,湖北省黄石市下陆区团城山街道杭州东路社区
2556,柯尔山社区,115.034904,30.193466,柯尔山社区,黄石市,湖北省,11,湖北省黄石市下陆区团城山街道柯尔山社区
2557,皇姑岭社区,115.02224,30.213329,皇姑岭社区,黄石市,湖北省,3,湖北省黄石市下陆区团城山街道皇姑岭社区
2558,石榴园社区,115.077682,30.21833,石榴园社区,黄石市,湖北省,2,湖北省黄石市下陆区团城山街道石榴园社区
2559,箭楼下社区,115.02507,30.194656,箭楼下社区,黄石市,湖北省,22,湖北省黄石市下陆区团城山街道箭楼下社区
2560,肖家铺社区,115.016289,30.205641,肖家铺社区,黄石市,湖北省,4,湖北省黄石市下陆区团城山街道肖家铺社区
2561,袁家畈社区,115.006271,30.19644,袁家畈社区,黄石市,湖北省,6,湖北省黄石市下陆区团城山街道袁家畈社区
2562,陈柏臻社区,115.01152,30.19734,陈柏臻社区,黄石市,湖北省,3,湖北省黄石市下陆区团城山街道陈柏臻社区
2563,青龙山社区,115.01152,30.19734,青龙山社区,黄石市,湖北省,15,湖北省黄石市下陆区团城山街道青龙山社区
2564,马鞍山社区,115.027748,30.220369,马鞍山社区,黄石市,湖北省,3,湖北省黄石市下陆区团城山街道马鞍山社区
2565,孔雀苑社区,114.952759,30.17602,孔雀苑社区,黄石市,湖北省,3,湖北省黄石市下陆区新下陆街道孔雀苑社区
2566,胜利社区,114.971802,30.172905,胜利社区,黄石市,湖北省,1,湖北省黄石市下陆区新下陆街道胜利社区
2567,西花苑社区,114.94825,30.168816,西花苑社区,黄石市,湖北省,3,湖北省黄石市下陆区新下陆街道西花苑社区
2568,铜花社区,114.959801,30.168631,铜花社区,黄石市,湖北省,5,湖北省黄石市下陆区新下陆街道铜花社区
2569,铜都社区,114.953476,30.172209,铜都社区,黄石市,湖北省,5,湖北省黄石市下陆区新下陆街道铜都社区
2570,陆家铺社区,114.965843,30.17503,陆家铺社区,黄石市,湖北省,1,湖北省黄石市下陆区新下陆街道陆家铺社区
2571,团结社区,114.984711,30.181011,团结社区,黄石市,湖北省,5,湖北省黄石市下陆区老下陆街道团结社区
2572,大塘社区,114.978943,30.17922,大塘社区,黄石市,湖北省,4,湖北省黄石市下陆区老下陆街道大塘社区
2573,康宁社区,114.978851,30.179602,康宁社区,黄石市,湖北省,1,湖北省黄石市下陆区老下陆街道康宁社区
2574,神牛社区,114.973351,30.180349,神牛社区,黄石市,湖北省,2,湖北省黄石市下陆区老下陆街道神牛社区
2575,蜂烈山社区,114.996529,30.20615,蜂烈山社区,黄石市,湖北省,1,湖北省黄石市下陆区老下陆街道蜂烈山社区
2576,人信城3栋,112.24118,30.339411,人信城3栋,荆州市,湖北省,1,湖北省荆州市沙市区中山路街道人信城3栋
2577,公园路,112.24662,30.312981,公园路,荆州市,湖北省,2,湖北省荆州市沙市区中山路街道公园路
2578,公园路公园宿舍,112.245277,30.316105,公园路公园宿舍,荆州市,湖北省,2,湖北省荆州市沙市区中山路街道公园路公园宿舍
2579,公园路江津花,112.245522,30.31303,公园路江津花,荆州市,湖北省,1,湖北省荆州市沙市区中山路街道公园路江津花
2580,凤台坊,112.245728,30.31012,凤台坊,荆州市,湖北省,1,湖北省荆州市沙市区中山路街道凤台坊
2581,凤台坊24栋,112.245728,30.31012,凤台坊24栋,荆州市,湖北省,1,湖北省荆州市沙市区中山路街道凤台坊24栋
2582,北京路,112.238998,30.321989,北京路,荆州市,湖北省,1,湖北省荆州市沙市区中山路街道北京路
2583,园林东路益寿园17栋,112.256691,30.315651,园林东路益寿园17栋,荆州市,湖北省,1,湖北省荆州市沙市区中山路街道园林东路益寿园17栋
2584,城市御园12栋,112.258888,30.3349,城市御园12栋,荆州市,湖北省,1,湖北省荆州市沙市区中山路街道城市御园12栋
2585,外滩阳光,112.249969,30.302521,外滩阳光,荆州市,湖北省,1,湖北省荆州市沙市区中山路街道外滩阳光
2586,文化坊,112.256889,30.30945,文化坊,荆州市,湖北省,1,湖北省荆州市沙市区中山路街道文化坊
2587,楚天都市佳园33栋,112.256287,30.334999,楚天都市佳园33栋,荆州市,湖北省,1,湖北省荆州市沙市区中山路街道楚天都市佳园33栋
2588,江汉北路,112.265182,30.326151,江汉北路,荆州市,湖北省,1,湖北省荆州市沙市区中山路街道江汉北路
2589,江汉北路云中阁,112.260048,30.31839,江汉北路云中阁,荆州市,湖北省,1,湖北省荆州市沙市区中山路街道江汉北路云中阁
2590,江津路玉桥小区紫竹苑2栋,112.275375,30.308933,江津路玉桥小区紫竹苑2栋,荆州市,湖北省,1,湖北省荆州市沙市区中山路街道江津路玉桥小区紫竹苑2栋
2591,洪门路华容小区42栋,112.263741,30.312731,洪门路华容小区42栋,荆州市,湖北省,1,湖北省荆州市沙市区中山路街道洪门路华容小区42栋
2592,滨湖国际2栋,112.257042,30.32198,滨湖国际2栋,荆州市,湖北省,1,湖北省荆州市沙市区中山路街道滨湖国际2栋
2593,滨湖国际小区,112.257042,30.32198,滨湖国际小区,荆州市,湖北省,1,湖北省荆州市沙市区中山路街道滨湖国际小区
2594,滨湖国际小区2栋,112.257042,30.32198,滨湖国际小区2栋,荆州市,湖北省,1,湖北省荆州市沙市区中山路街道滨湖国际小区2栋
2595,硚房康城八号楼,112.23925,30.333059,硚房康城八号楼,荆州市,湖北省,1,湖北省荆州市沙市区中山路街道硚房康城八号楼
2596,红星路华侨城5栋,112.273392,30.307793,红星路华侨城5栋,荆州市,湖北省,1,湖北省荆州市沙市区中山路街道红星路华侨城5栋
2597,肖家坊12栋,112.249763,30.304302,肖家坊12栋,荆州市,湖北省,1,湖北省荆州市沙市区中山路街道肖家坊12栋
2598,航空路,112.259804,30.308969,航空路,荆州市,湖北省,1,湖北省荆州市沙市区中山路街道航空路
2599,蛇入山橡胶二厂宿舍,112.249763,30.304302,蛇入山橡胶二厂宿舍,荆州市,湖北省,1,湖北省荆州市沙市区中山路街道蛇入山橡胶二厂宿舍
2600,长港路2栋,112.28782,30.30224,长港路2栋,荆州市,湖北省,1,湖北省荆州市沙市区中山路街道长港路2栋
2601,顺驰太阳城,112.254768,30.32778,顺驰太阳城,荆州市,湖北省,1,湖北省荆州市沙市区中山路街道顺驰太阳城
2602,黄家塘,112.252853,30.30909,黄家塘,荆州市,湖北省,1,湖北省荆州市沙市区中山路街道黄家塘
2603,黄家塘195栋,112.252853,30.30909,黄家塘195栋,荆州市,湖北省,1,湖北省荆州市沙市区中山路街道黄家塘195栋
2604,黄家塘8栋,112.252853,30.30909,黄家塘8栋,荆州市,湖北省,2,湖北省荆州市沙市区中山路街道黄家塘8栋
2605,,112.280067,30.380819,凤凰村,荆州市,湖北省,1,湖北省荆州市沙市区关沮镇凤凰村
