id,name,lng,lat,address,city,province,count,full_address
1222,珀丽湾小区,112.458076,23.030479,珀丽湾小区,肇庆市,广东省,1,广东省肇庆市高要区南岸街道珀丽湾小区
1223,,112.316093,23.045719,禄岸村,肇庆市,广东省,1,广东省肇庆市高要区大湾镇禄岸村
1224,碧翠湖度假村,112.430084,23.606922,碧翠湖度假村,肇庆市,广东省,1,广东省肇庆市广宁县南街镇碧翠湖度假村
1225,,114.945778,24.162189,三河积良下村,河源市,广东省,1,广东省河源市东源县船塘镇三河积良下村
1226,,114.706543,23.743971,旺福路,河源市,广东省,1,广东省河源市源城区旺福路
1227,,110.600662,21.438351,企石村,湛江市,广东省,1,广东省湛江市吴川市塘缀镇企石村
1228,汇景湾渡假村,110.864052,21.38648,汇景湾渡假村,湛江市,广东省,1,广东省湛江市吴川市汇景湾渡假村
1229,鼎龙湾2期,110.864388,21.386234,鼎龙湾2期,湛江市,广东省,1,广东省湛江市吴川市鼎龙湾2期
1230,湾南路40号,110.374424,21.268853,湾南路40号,湛江市,广东省,1,广东省湛江市赤坎区湾南路40号
1231,茂达居,110.361763,21.282101,茂达居,湛江市,广东省,1,广东省湛江市赤坎区茂达居
1232,嘉愉假日酒店,110.393646,21.186319,嘉愉假日酒店,湛江市,广东省,1,广东省湛江市霞山区嘉愉假日酒店
1233,金祥花园金银阁,110.414818,21.21167,金祥花园金银阁,湛江市,广东省,1,广东省湛江市霞山区金祥花园金银阁
1234,人民大道中13号邮电小区,110.39564,21.215,人民大道中13号邮电小区,湛江市,广东省,1,广东省湛江市霞山区人民大道中13号邮电小区
1235,,110.121429,21.78653,山心村,湛江市,广东省,1,广东省湛江市廉江市塘蓬镇山心村
1236,恒大绿洲,110.457733,21.256041,恒大绿洲,湛江市,广东省,1,广东省湛江市坡头区恒大绿洲
1237,,110.456093,21.341709,绿水村委会山口村,湛江市,广东省,1,广东省湛江市坡头区龙头镇绿水村委会山口村
1238,金地豪苑帝景庭,110.419907,21.212351,金地豪苑帝景庭,湛江市,广东省,1,广东省湛江市开发区金地豪苑帝景庭
1239,,109.749687,20.87678,曲港村,湛江市,广东省,1,广东省湛江市雷州市纪家镇曲港村
1240,幸福农场旧市场,110.01181,20.56222,幸福农场旧市场,湛江市,广东省,1,广东省湛江市雷州市英利镇幸福农场旧市场
1241,万科金色梦想,113.529778,23.16321,万科金色梦想,广州市,广东省,1,广东省广州市黄埔区云埔街万科金色梦想
1242,中海誉城,113.5263,23.16194,中海誉城,广州市,广东省,1,广东省广州市黄埔区云埔街道中海誉城
1243,亨元花园,113.5355,23.0947,亨元花园,广州市,广东省,1,广东省广州市黄埔区南岗街广海路亨元花园
1244,夏港街蓝玉五街,113.48067,23.18139,夏港街蓝玉五街,广州市,广东省,1,广东省广州市黄埔区夏港街蓝玉五街
1245,君和名城,113.453697,23.10795,君和名城,广州市,广东省,1,广东省广州市黄埔区大沙街丰乐北路君和名城
1246,保利林语山庄芳林二街,113.454651,23.182159,保利林语山庄芳林二街,广州市,广东省,1,广东省广州市黄埔区联和街保利林语山庄芳林二街
1247,金碧世纪花园,113.4292,23.11397,金碧世纪花园,广州市,广东省,1,广东省广州市黄埔区金碧世纪花园
1248,万科幸福誉,113.541656,23.33074,万科幸福誉,广州市,广东省,1,广东省广州市黄埔区龙湖街万科幸福誉
1249,东荟城,113.5036,23.15906,东荟城,广州市,广东省,1,广东省广州市黄埔区云埔街道东荟城
1250,岭南山畔,113.451691,23.177549,岭南山畔,广州市,广东省,1,广东省广州市黄埔区联和街道岭南山畔
1251,万科金色梦想,113.529778,23.16321,万科金色梦想,广州市,广东省,1,广东省广州市黄埔区云埔街道万科金色梦想
1252,万科幸福誉,113.541656,23.33074,万科幸福誉,广州市,广东省,1,广东省广州市黄埔区九龙镇万科幸福誉
1253,萝岗和苑,113.4799,23.18876,萝岗和苑,广州市,广东省,1,广东省广州市黄埔区长岭街道萝岗和苑
1254,万艺维福顿公寓,113.267288,23.115629,万艺维福顿公寓,广州市,广东省,1,广东省广州市越秀区人民街道万艺维福顿公寓
1255,,113.2974,23.12897,农林下路,广州市,广东省,1,广东省广州市越秀区农林下路
1256,金羊花园,113.309349,23.12674,金羊花园,广州市,广东省,1,广东省广州市越秀区梅花村街金羊花园
1257,水均岗,113.3061,23.1316,水均岗,广州市,广东省,1,广东省广州市越秀区水均岗
1258,,113.3106,23.14509,水荫路,广州市,广东省,1,广东省广州市越秀区水荫路
1259,御龙庭,113.295326,23.14267,御龙庭,广州市,广东省,1,广东省广州市越秀区淘金东路御龙庭
1260,,113.2876,23.13896,淘金路,广州市,广东省,1,广东省广州市越秀区淘金路
1261,,113.2668,23.12901,黄花岗街东风东路,广州市,广东省,1,广东省广州市越秀区黄花岗街东风东路
1262,,113.267609,23.11598,人民街道回龙路,广州市,广东省,1,广东省广州市越秀区人民街道回龙路
1263,侨光路万艺广场,113.267357,23.116051,侨光路万艺广场,广州市,广东省,1,广东省广州市越秀区侨光路万艺广场
1264,,113.262428,23.121481,光塔街解放中路,广州市,广东省,1,广东省广州市越秀区光塔街解放中路
1265,,113.286613,23.12455,大东街道东川路,广州市,广东省,1,广东省广州市越秀区大东街道东川路
1266,,113.3076,23.12486,梅花村街道共和大街,广州市,广东省,1,广东省广州市越秀区梅花村街道共和大街
1267,,113.262894,23.14809,流花街道,广州市,广东省,1,广东省广州市越秀区流花街道
1268,,113.2611,23.1164,人民街道大新路小新街,广州市,广东省,1,广东省广州市越秀区人民街道大新路小新街
1269,武汉宾馆,113.254059,23.146099,武汉宾馆,广州市,广东省,1,广东省广州市越秀区流花街道武汉宾馆
1270,大新路,113.254143,23.11504,大新路,广州市,广东省,1,广东省广州市越秀区人民街道大新路
1271,,113.2668,23.12159,北京街道起义路,广州市,广东省,1,广东省广州市越秀区北京街道起义路
1272,,113.2749,23.1418,登峰街道下塘宝汉直街,广州市,广东省,1,广东省广州市越秀区登峰街道下塘宝汉直街
1273,和平家园,113.31469,23.086691,和平家园,广州市,广东省,1,广东省广州市海珠区凤阳街道和平家园
1274,南华西街道同福西路,113.254318,23.1028,南华西街道同福西路,广州市,广东省,1,广东省广州市海珠区南华西街道同福西路
1275,保利花园,113.273849,23.07091,保利花园,广州市,广东省,1,广东省广州市海珠区南石头街道保利花园
1276,国际轻纺城双子星城星辰轩,113.298744,23.090517,国际轻纺城双子星城星辰轩,广州市,广东省,1,广东省广州市海珠区新港街国际轻纺城双子星城星辰轩
1277,,113.3369,23.08781,江海街石榴岗路,广州市,广东省,1,广东省广州市海珠区江海街石榴岗路
1278,锦江之星,113.278633,23.079889,锦江之星,广州市,广东省,1,广东省广州市海珠区锦江之星
1279,船舶太古酒店,113.25473,23.089569,船舶太古酒店,广州市,广东省,1,广东省广州市海珠区革新路船舶太古酒店
1280,富力现代,113.258217,23.09087,富力现代,广州市,广东省,1,广东省广州市海珠区龙凤街道金沙路富力现代
1281,江悦酒店,113.246803,23.102831,江悦酒店,广州市,广东省,1,广东省广州市海珠区江悦酒店
1282,,113.33124,23.08475,江海街道大塘东边街,广州市,广东省,1,广东省广州市海珠区江海街道大塘东边街
1283,,113.282532,23.108385,滨江街道沙地直街,广州市,广东省,1,广东省广州市海珠区滨江街道沙地直街
1284,琶洲新村,113.38181,23.10041,琶洲新村,广州市,广东省,1,广东省广州市海珠区琶洲街道琶洲新村
1285,,113.3369,23.08781,赤岗街石榴岗路,广州市,广东省,1,广东省广州市海珠区赤岗街石榴岗路
1286,纵横公寓,113.330078,23.095711,纵横公寓,广州市,广东省,1,广东省广州市海珠区赤岗街道纵横公寓
1287,金碧花园,113.287079,23.069,金碧花园,广州市,广东省,1,广东省广州市海珠区瑞宝街道金碧花园
1288,凤凰二街,113.25882,23.091709,凤凰二街,广州市,广东省,1,广东省广州市海珠区龙凤街道凤凰二街
1289,万科华庭,113.253197,23.10318,万科华庭,广州市,广东省,1,广东省广州市海珠区南华西街道万科华庭
1290,细岗路,113.2808,23.09194,细岗路,广州市,广东省,1,广东省广州市海珠区昌岗街道细岗路
1291,金盛大厦,113.275223,23.090321,金盛大厦,广州市,广东省,1,广东省广州市海珠区昌岗街道金盛大厦
1292,南村聚源八巷,113.268036,23.104668,南村聚源八巷,广州市,广东省,1,广东省广州市海珠区江南中街道南村聚源八巷
1293,江南乐居苑,113.26075,23.095329,江南乐居苑,广州市,广东省,1,广东省广州市海珠区龙凤街道江南乐居苑
1294,土华洪福新村,113.35849,23.070265,土华洪福新村,广州市,广东省,1,广东省广州市海珠区华洲街道土华洪福新村
1295,影城花苑,113.318741,23.095736,影城花苑,广州市,广东省,1,广东省广州市海珠区赤岗街道影城花苑
1296,泰沙路马岗顶,113.28492,23.080151,泰沙路马岗顶,广州市,广东省,1,广东省广州市海珠区凤阳街道泰沙路马岗顶
1297,上冲桥南新街,113.32269,23.08063,上冲桥南新街,广州市,广东省,1,广东省广州市海珠区南洲街道上冲桥南新街
1298,中大浦园,113.295288,23.10005,中大浦园,广州市,广东省,1,广东省广州市海珠区新港街道中大浦园
1299,阅江路,113.339203,23.10784,阅江路,广州市,广东省,1,广东省广州市海珠区琶洲街道阅江路
1300,瑞源街二十巷,113.29475,23.07865,瑞源街二十巷,广州市,广东省,1,广东省广州市海珠区瑞宝街道瑞源街二十巷
1301,革新路银山尚橙小区,113.253639,23.0945,革新路银山尚橙小区,广州市,广东省,1,广东省广州市海珠区龙凤街道革新路银山尚橙小区
1302,聚龙新街,113.278931,23.09795,聚龙新街,广州市,广东省,1,广东省广州市海珠区江南中街道前进路聚龙新街
1303,保利天悦,113.3796,23.1026,保利天悦,广州市,广东省,1,广东省广州市海珠区琶洲街道阅江中路保利天悦
1304,台涌村新街,113.3426,23.083704,台涌村新街,广州市,广东省,1,广东省广州市海珠区江海街道台涌村新街
1305,中海橡园,113.25901,23.08857,中海橡园,广州市,广东省,1,广东省广州市海珠区沙园街道水榕路中海橡园
1306,沙园街昌岗中路,113.26444,23.08427,沙园街昌岗中路,广州市,广东省,1,广东省广州市海珠区昌岗中路33号
1307,瑞宝街金恒路,113.28851,23.0652,瑞宝街金恒路,广州市,广东省,1,广东省广州市海珠区瑞宝街道金恒北一街24号102房
1308,小港路涌边东九巷,113.281212,23.06847,小港路涌边东九巷,广州市,广东省,1,广东省广州市海珠区石溪涌边街9号
1309,南石头街鸡春岗新街,113.26557,23.07658,南石头街鸡春岗新街,广州市,广东省,1,广东省广州市海珠区鸡春岗新街1号小区
1310,新雍丽酒店,113.577629,23.5555,新雍丽酒店,广州市,广东省,1,广东省广州市从化区城郊街新雍丽酒店
1311,宾馆新村,113.21106,23.38225,宾馆新村,广州市,广东省,1,广东省广州市花都区新华街宾馆新村
1312,锦尚蓬莱,113.236931,23.390711,锦尚蓬莱,广州市,广东省,1,广东省广州市花都区新华街锦尚蓬莱
1313,合和新城锦华,113.256203,23.37289,合和新城锦华,广州市,广东省,1,广东省广州市花都区新雅街道合和新城锦华
1314,,113.181427,23.45462,合成村,广州市,广东省,1,广东省广州市花都区狮岭镇合成村
1315,雅宝新城英伦世家,113.186249,23.426645,雅宝新城英伦世家,广州市,广东省,1,广东省广州市花都区秀全街雅宝新城英伦世家
1316,自由人花园2期,113.220055,23.342855,自由人花园2期,广州市,广东省,1,广东省广州市花都区自由人花园2期
1317,南航花园,113.232307,23.402094,南航花园,广州市,广东省,1,广东省广州市花都区花城街道南航花园
1318,长岗村,113.2585,23.32361,长岗村,广州市,广东省,1,广东省广州市花都区花城街道长岗村
1319,景雅轩小区,113.205872,23.398109,景雅轩小区,广州市,广东省,1,广东省广州市花都区新华街道景雅轩小区
1320,合和新城,113.256203,23.37289,合和新城,广州市,广东省,1,广东省广州市花都区合和新城
1321,,113.22026,23.40391,沙芒南5巷,广州市,广东省,1,广东省广州市花都区沙芒南5巷
1322,建设北路,113.206978,23.405479,建设北路,广州市,广东省,1,广东省广州市花都区新华街道建设北路
1323,坦头村槽船一街,113.564842,22.806219,坦头村槽船一街,广州市,广东省,1,广东省广州市南沙区南沙街坦头村槽船一街
1324,叠翠峰,113.520531,22.796789,叠翠峰,广州市,广东省,1,广东省广州市南沙区叠翠峰
1325,,113.342903,22.83831,蔡源东街,广州市,广东省,1,广东省广州市南沙区榄核镇蔡源东街
1326,碧桂园天玺湾小区,113.577682,22.79892,碧桂园天玺湾小区,广州市,广东省,1,广东省广州市南沙区碧桂园天玺湾小区
1327,万科南方公元,113.501678,22.8053,万科南方公元,广州市,广东省,1,广东省广州市南沙区黄阁镇万科南方公元
1328,璧珑湾,113.529839,22.79995,璧珑湾,广州市,广东省,1,广东省广州市南沙区黄阁镇璧珑湾
1329,中海花湾,113.236557,23.068319,中海花湾,广州市,广东省,1,广东省广州市荔湾区中海花湾
1330,丽枫酒店长寿东路店,113.25162,23.11822,丽枫酒店长寿东路店,广州市,广东省,1,广东省广州市荔湾区华林街道光复中路丽枫酒店长寿东路店
1331,华林街道文昌南路,113.244522,23.11524,华林街道文昌南路,广州市,广东省,1,广东省广州市荔湾区华林街道文昌南路
1332,凯粤湾,113.214706,23.115641,凯粤湾,广州市,广东省,1,广东省广州市荔湾区石围塘街凯粤湾
1333,,113.251465,23.127632,金花街道芦荻街,广州市,广东省,1,广东省广州市荔湾区金花街道芦荻街
1334,御景壹号,113.235573,23.109541,御景壹号,广州市,广东省,1,广东省广州市荔湾区多宝街道御景壹号
1335,恒荔湾畔,113.231979,23.101311,恒荔湾畔,广州市,广东省,1,广东省广州市荔湾区花地街道恒荔湾畔
1336,,113.216,23.1086,石围塘街道兴东路,广州市,广东省,1,广东省广州市荔湾区石围塘街道兴东路
1337,龙津中路,113.243599,23.12429,龙津中路,广州市,广东省,1,广东省广州市荔湾区金花街道龙津中路
1338,招村南胜九巷,113.2389,23.08655,招村南胜九巷,广州市,广东省,1,广东省广州市荔湾区冲口街道招村南胜九巷
1339,体育西小区,113.325111,23.130356,体育西小区,广州市,广东省,1,广东省广州市天河区体育西小区
1340,兴华街沙太南路,113.322929,23.16279,兴华街沙太南路,广州市,广东省,1,广东省广州市天河区兴华街沙太南路
1341,冼村街道华明路,113.322487,23.12216,冼村街道华明路,广州市,广东省,1,广东省广州市天河区冼村街道华明路
1342,珠光御景,113.349,23.11773,珠光御景,广州市,广东省,1,广东省广州市天河区冼村街道潭村路珠光御景
1343,珠光新城御景二期,113.34836,23.11635,珠光新城御景二期,广州市,广东省,1,广东省广州市天河区冼村街道珠光新城御景二期
1344,富力花园,113.3434,23.11352,富力花园,广州市,广东省,1,广东省广州市天河区冼村街道马场路富力花园
1345,凤凰街道渔兴路,113.375671,23.20586,凤凰街道渔兴路,广州市,广东省,1,广东省广州市天河区凤凰街道渔兴路
1346,盈彩美居街彩轩,113.418221,23.114429,盈彩美居街彩轩,广州市,广东省,1,广东省广州市天河区前进街盈彩美居街彩轩
1347,合景路,113.408478,23.155712,合景路,广州市,广东省,1,广东省广州市天河区合景路
1348,天河新作,113.332497,23.135639,天河新作,广州市,广东省,1,广东省广州市天河区天河新作
1349,云城米酷,113.385094,23.16831,云城米酷,广州市,广东省,1,广东省广州市天河区新塘街华观路云城米酷
1350,棠下荷光广州锦顺酒店,113.375183,23.13146,棠下荷光广州锦顺酒店,广州市,广东省,1,广东省广州市天河区棠下荷光广州锦顺酒店
1351,华景新城陶然庭苑,113.3614,23.13787,华景新城陶然庭苑,广州市,广东省,1,广东省广州市天河区棠下街华景新城陶然庭苑
1352,棠雅苑,113.367973,23.13464,棠雅苑,广州市,广东省,1,广东省广州市天河区棠下街枫叶路棠雅苑
1353,新景苑小区,113.369438,23.124331,新景苑小区,广州市,广东省,1,广东省广州市天河区棠下街道棠石路新景苑小区
1354,海景花园,113.366653,23.123301,海景花园,广州市,广东省,1,广东省广州市天河区海景花园
1355,猎德街猎德复建房,113.335274,23.113651,猎德街猎德复建房,广州市,广东省,1,广东省广州市天河区猎德街猎德复建房
1356,暨南大学羊城苑,113.3474,23.1312,暨南大学羊城苑,广州市,广东省,1,广东省广州市天河区石牌街暨南大学羊城苑
1357,林南文化酒店,113.396828,23.124229,林南文化酒店,广州市,广东省,1,广东省广州市天河区车陂街林南文化酒店
1358,金燕花苑,113.3334,23.15329,金燕花苑,广州市,广东省,1,广东省广州市天河区兴华街道粤垦路金燕花苑
1359,珠光新城御景,113.346802,23.116159,珠光新城御景,广州市,广东省,1,广东省广州市天河区冼村街道珠光新城御景
1360,南丫村,113.227409,23.044609,南丫村,广州市,广东省,1,广东省广州市天河区中南街道南丫村
1361,锦顺酒店,113.375183,23.13146,锦顺酒店,广州市,广东省,1,广东省广州市天河区棠下街道锦顺酒店
1362,城市假日园,113.40387,23.125919,城市假日园,广州市,广东省,1,广东省广州市天河区车陂街道城市假日园
1363,沙太南路,113.323479,23.16333,沙太南路,广州市,广东省,1,广东省广州市天河区兴华街道沙太南路
1364,潭村珠光新城御景,113.346802,23.116159,潭村珠光新城御景,广州市,广东省,1,广东省广州市天河区冼村街道潭村珠光新城御景
1365,雅居乐北苑,113.383362,23.0252,雅居乐北苑,广州市,广东省,1,广东省广州市番禺区南村镇雅居乐北苑
1366,名伦花园,113.329849,23.011339,名伦花园,广州市,广东省,1,广东省广州市番禺区名伦花园
1367,大龙街尚东尚筑,113.404831,22.938204,大龙街尚东尚筑,广州市,广东省,1,广东省广州市番禺区大龙街尚东尚筑
1368,维也纳石桥中心店,113.366379,22.941154,维也纳石桥中心店,广州市,广东省,1,广东省广州市番禺区市桥街道维也纳石桥中心店
1369,星河湾半岛,113.352707,23.030411,星河湾半岛,广州市,广东省,1,广东省广州市番禺区星河湾半岛
1370,亚运城媒体村,113.473656,22.944351,亚运城媒体村,广州市,广东省,1,广东省广州市番禺区石楼镇亚运城媒体村
1371,碧桂园东苑倚翠路,113.286331,22.9526,碧桂园东苑倚翠路,广州市,广东省,1,广东省广州市番禺区碧桂园东苑倚翠路
1372,祈福新村祈福名都,113.334442,22.97246,祈福新村祈福名都,广州市,广东省,1,广东省广州市番禺区祈福新村祈福名都
1373,金山谷花园,113.34697,22.977591,金山谷花园,广州市,广东省,1,广东省广州市番禺区金山谷花园
1374,陈涌村,113.372078,22.918659,陈涌村,广州市,广东省,1,广东省广州市番禺区桥南街道陈涌村
1375,大社坊中心街,113.378098,22.957781,大社坊中心街,广州市,广东省,1,广东省广州市番禺区甘棠村东环街大社坊中心街
1376,市桥街丽柏酒店,113.368927,22.94615,市桥街丽柏酒店,广州市,广东省,1,广东省广州市番禺区市桥街丽柏酒店
1377,祈福缤纷汇,113.333458,22.970449,祈福缤纷汇,广州市,广东省,1,广东省广州市番禺区钟村街道祈福缤纷汇
1378,东湖洲花园,113.418259,22.9277,东湖洲花园,广州市,广东省,1,广东省广州市番禺区大龙街道东湖洲花园
1379,未来域,113.311104,22.977942,未来域,广州市,广东省,1,广东省广州市番禺区未来域
1380,荷景一区,113.34481,22.903303,荷景一区,广州市,广东省,1,广东省广州市番禺区沙湾街道荷景一区
1381,祈福新村活力花园,113.328949,22.969721,祈福新村活力花园,广州市,广东省,1,广东省广州市番禺区祈福新村活力花园
1382,鸿福路,113.334396,22.96796,鸿福路,广州市,广东省,1,广东省广州市番禺区钟村街道鸿福路
1383,太平洋花园,113.578033,23.11718,太平洋花园,广州市,广东省,1,广东省广州市增城区新塘镇太平洋花园
1384,尚东阳光,113.575249,23.10317,尚东阳光,广州市,广东省,1,广东省广州市增城区新塘镇尚东阳光
1385,翡翠绿洲,113.561668,23.138273,翡翠绿洲,广州市,广东省,1,广东省广州市增城区新塘镇翡翠绿洲
1386,西洲村,113.581223,23.101259,西洲村,广州市,广东省,1,广东省广州市增城区新塘镇西洲村
1387,西洲村豪门公寓,113.611107,23.119909,西洲村豪门公寓,广州市,广东省,1,广东省广州市增城区新塘镇西洲村豪门公寓
1388,中海城市广场,113.824699,23.28616,中海城市广场,广州市,广东省,1,广东省广州市增城区荔城街中海城市广场
1389,大墩村,113.668289,23.12541,大墩村,广州市,广东省,1,广东省广州市增城区新塘镇大墩村
1390,,113.61862,23.11626,富丽园二街,广州市,广东省,1,广东省广州市增城区新塘镇富丽园二街
1391,,113.851707,23.280397,增江街道碧桂园,广州市,广东省,1,广东省广州市增城区增江街道碧桂园
1392,碧桂园荔园,113.845337,23.275881,碧桂园荔园,广州市,广东省,1,广东省广州市增城区增江街道碧桂园荔园
1393,人和镇清河渡头街,113.295616,23.334291,人和镇清河渡头街,广州市,广东省,1,广东省广州市白云区人和镇清河渡头街
1394,蔚徕酒店,113.372208,23.419666,蔚徕酒店,广州市,广东省,1,广东省广州市白云区人和镇西成路蔚徕酒店
1395,保利西海岸江海花园,113.210342,23.171091,保利西海岸江海花园,广州市,广东省,1,广东省广州市白云区保利西海岸江海花园
1396,元邦航空家园,113.25914,23.204926,元邦航空家园,广州市,广东省,1,广东省广州市白云区元邦航空家园
1397,南湖高尔夫公寓,113.27324,23.15792,南湖高尔夫公寓,广州市,广东省,1,广东省广州市白云区南湖高尔夫公寓
1398,南航明珠酒店,113.297417,23.37195,南航明珠酒店,广州市,广东省,1,广东省广州市白云区南航明珠酒店
1399,同景东街,113.2341,23.15594,同景东街,广州市,广东省,1,广东省广州市白云区同景东街
1400,心谊路,113.256,23.17091,心谊路,广州市,广东省,1,广东省广州市白云区心谊路
1401,时代玫瑰园,113.2868,23.22481,时代玫瑰园,广州市,广东省,1,广东省广州市白云区时代玫瑰园
1402,景云居,113.277382,23.16374,景云居,广州市,广东省,1,广东省广州市白云区景云路景云居
1403,梅滨大厦,113.325623,23.179939,梅滨大厦,广州市,广东省,1,广东省广州市白云区梅滨大厦
1404,棠景街国强北街,113.27324,23.15792,棠景街国强北街,广州市,广东省,1,广东省广州市白云区棠景街国强北街
1405,贝丽花园,113.2547,23.17975,贝丽花园,广州市,广东省,1,广东省广州市白云区棠景街道岗贝路贝丽花园
1406,,113.206512,23.27076,海口直街,广州市,广东省,1,广东省广州市白云区江高镇大田村海口直街
1407,,113.23481,23.195539,石井街道石潭路,广州市,广东省,1,广东省广州市白云区石井街道石潭路
1408,金沙洲保利西子湾,113.210663,23.148121,金沙洲保利西子湾,广州市,广东省,1,广东省广州市白云区金沙洲保利西子湾
1409,鹤龙街联边彭西一街,113.2763,23.23057,鹤龙街联边彭西一街,广州市,广东省,1,广东省广州市白云区鹤龙街联边彭西一街
1410,鹤龙街道乐得花园,113.2753,23.22261,鹤龙街道乐得花园,广州市,广东省,1,广东省广州市白云区鹤龙街道乐得花园
1411,黄边安怀里,113.270767,23.21464,黄边安怀里,广州市,广东省,1,广东省广州市白云区鹤龙街道黄边安怀里
1412,麒麟新村三街二巷,113.337,23.18636,麒麟新村三街二巷,广州市,广东省,1,广东省广州市白云区麒麟新村三街二巷
1413,黄石花园,113.2672,23.20441,黄石花园,广州市,广东省,1,广东省广州市白云区黄石花园
1414,,113.27324,23.15792,黄石街二街,广州市,广东省,1,广东省广州市白云区黄石街二街
1415,白云尚城,113.2852,23.21342,白云尚城,广州市,广东省,1,广东省广州市白云区黄石街白云尚城
1416,,113.253189,23.1733,三元里街道棠下三官后街,广州市,广东省,1,广东省广州市白云区三元里街道棠下三官后街
1417,,113.321602,23.18165,京溪街道广州大道北,广州市,广东省,1,广东省广州市白云区京溪街道广州大道北
1418,,113.266,23.18625,永平街道永泰中街,广州市,广东省,1,广东省广州市白云区永平街道永泰中街
1419,乐嘉路,113.2575,23.16799,乐嘉路,广州市,广东省,1,广东省广州市白云区棠景街道乐嘉路
1420,江夏流铁岗,113.2786,23.21252,江夏流铁岗,广州市,广东省,1,广东省广州市白云区江夏流铁岗
