id,name,lng,lat,address,city,province,count,full_address
3635,清华大溪地,113.445847,34.750912,清华大溪地,郑州市,河南省,1,河南省郑州市荥阳市豫龙镇清华大溪地
3636,锦绣家园,113.41729,34.781399,锦绣家园,郑州市,河南省,1,河南省郑州市荥阳市京城街道三公路锦绣家园
3637,,111.024986,33.243679,荆紫关镇,南阳市,河南省,1,河南省南阳市淅川县荆紫关镇
3638,,111.793518,32.696369,九重镇,南阳市,河南省,1,河南省南阳市淅川县九重镇
3639,,112.541702,32.994469,新华街道,南阳市,河南省,1,河南省南阳市宛城区新华街道
3640,,112.538422,33.013279,汉冶路,南阳市,河南省,1,河南省南阳市宛城区汉冶路
3641,,112.539017,32.856758,黄台岗镇,南阳市,河南省,3,河南省南阳市宛城区黄台岗镇
3642,汉冶办事处,112.51812,33.017509,汉冶办事处,南阳市,河南省,3,河南省南阳市宛城区汉冶办事处
3643,,112.522346,32.752731,瓦店镇,南阳市,河南省,1,河南省南阳市宛城区瓦店镇
3644,,112.689125,32.93325,茶庵乡,南阳市,河南省,1,河南省南阳市宛城区茶庵乡
3645,,113.01078,33.460369,拐河镇,南阳市,河南省,1,河南省南阳市方城县拐河镇
3646,,112.911751,33.253101,清河乡,南阳市,河南省,1,河南省南阳市方城县清河乡
3647,,113.167603,33.321709,独树镇,南阳市,河南省,1,河南省南阳市方城县独树镇
3648,,112.620659,32.690353,官庄镇,南阳市,河南省,1,河南省南阳市官庄工区官庄镇
3649,赤虎办事处,112.599098,32.685188,赤虎办事处,南阳市,河南省,2,河南省南阳市官庄工区赤虎办事处
3650,,112.610512,32.681019,赤虎街道,南阳市,河南省,2,河南省南阳市官庄工区赤虎街道
3651,,112.945183,32.869797,太和镇,南阳市,河南省,2,河南省南阳市社旗县太和镇
3652,,113.149384,32.863869,朱集镇,南阳市,河南省,4,河南省南阳市社旗县朱集镇
3653,,112.88726,32.854061,李店镇,南阳市,河南省,2,河南省南阳市社旗县李店镇
3654,,113.126518,33.045341,下洼镇,南阳市,河南省,1,河南省南阳市社旗县下洼镇
3655,白河街道办,112.590851,32.975471,白河街道办,南阳市,河南省,1,河南省南阳市示范区白河街道办
3656,,112.157661,32.732101,张楼乡,南阳市,河南省,1,河南省南阳市邓州市张楼乡
3657,,111.958282,32.741219,文渠镇,南阳市,河南省,2,河南省南阳市邓州市文渠镇
3658,,112.220329,32.75618,白牛镇,南阳市,河南省,1,河南省南阳市邓州市白牛镇
3659,,112.095131,32.599739,龙堰乡,南阳市,河南省,1,河南省南阳市邓州市龙堰乡
3660,,111.47244,33.3056,城关镇,南阳市,河南省,1,河南省南阳市西峡县城关镇
3661,,112.21862,32.94101,侯集镇,南阳市,河南省,3,河南省南阳市镇平县侯集镇
3662,,112.335297,32.95462,彭营乡,南阳市,河南省,1,河南省南阳市镇平县彭营乡
3663,,112.084152,32.947021,贾宋镇,南阳市,河南省,1,河南省南阳市镇平县贾宋镇
3664,,112.257172,32.890282,郭庄乡,南阳市,河南省,2,河南省南阳市镇平县郭庄乡
3665,,112.084068,33.157131,高丘镇,南阳市,河南省,2,河南省南阳市镇平县高丘镇
3666,,112.263992,33.033482,雪枫街道,南阳市,河南省,1,河南省南阳市镇平县雪枫街道
3667,,112.23774,33.036617,北关村,南阳市,河南省,1,河南省南阳市镇平县北关村
3668,雪枫办,112.254791,33.035809,雪枫办,南阳市,河南省,1,河南省南阳市镇平县雪枫办
3669,,113.501892,32.422379,吴城镇,南阳市,河南省,3,河南省南阳市桐柏县吴城镇
3670,,113.411949,32.37009,城关镇,南阳市,河南省,1,河南省南阳市桐柏县城关镇
3671,,113.403191,32.369801,城郊乡,南阳市,河南省,5,河南省南阳市桐柏县城郊乡
3672,,113.694603,32.534649,毛集镇,南阳市,河南省,4,河南省南阳市桐柏县毛集镇
3673,,113.298264,32.416489,淮源镇,南阳市,河南省,1,河南省南阳市桐柏县淮源镇
3674,,112.757309,32.562462,上屯镇,南阳市,河南省,2,河南省南阳市唐河县上屯镇
3675,,112.820312,32.676891,北京大道,南阳市,河南省,1,河南省南阳市唐河县北京大道
3676,,112.919258,32.773479,源潭镇,南阳市,河南省,1,河南省南阳市唐河县源潭镇
3677,,112.743729,32.488529,黑龙镇,南阳市,河南省,2,河南省南阳市唐河县黑龙镇
3678,,112.651192,32.429451,龙潭镇,南阳市,河南省,5,河南省南阳市唐河县龙潭镇
3679,,112.544342,32.416061,苍台镇,南阳市,河南省,1,河南省南阳市唐河县苍台镇
3680,,113.1436,32.795879,少拜寺乡,南阳市,河南省,1,河南省南阳市唐河县少拜寺乡
3681,,112.725471,32.79929,桐寨铺镇,南阳市,河南省,1,河南省南阳市唐河县桐寨铺镇
3682,,112.95607,32.511761,马振抚镇,南阳市,河南省,1,河南省南阳市唐河县马振抚镇
3683,,112.969902,32.687988,古城乡,南阳市,河南省,1,河南省南阳市唐河县古城乡
3684,,112.647682,33.395489,太山庙乡,南阳市,河南省,2,河南省南阳市南召县太山庙乡
3685,,112.633018,33.253738,皇路店镇,南阳市,河南省,1,河南省南阳市南召县皇路店镇
3686,,112.32663,32.50853,上港乡,南阳市,河南省,1,河南省南阳市新野县上港乡
3687,,112.520416,32.490021,前高庙乡,南阳市,河南省,1,河南省南阳市新野县前高庙乡
3688,,112.311623,32.407841,新甸铺镇,南阳市,河南省,2,河南省南阳市新野县新甸铺镇
3689,,112.550858,32.593578,施庵镇,南阳市,河南省,1,河南省南阳市新野县施庵镇
3690,,112.380997,32.521332,汉华街道,南阳市,河南省,1,河南省南阳市新野县汉华街道
3691,,112.30912,32.61541,王集镇,南阳市,河南省,1,河南省南阳市新野县王集镇
3692,七一街道办,112.515739,32.97913,七一街道办,南阳市,河南省,1,河南省南阳市卧龙区七一街道办
3693,,112.515739,32.97913,七一街道,南阳市,河南省,1,河南省南阳市卧龙区七一街道
3694,,112.551109,33.02961,七里园乡,南阳市,河南省,1,河南省南阳市卧龙区七里园乡
3695,卧龙岗街道办,112.512032,32.978149,卧龙岗街道办,南阳市,河南省,1,河南省南阳市卧龙区卧龙岗街道办
3696,,112.524033,32.991821,梅溪街道,南阳市,河南省,3,河南省南阳市卧龙区梅溪街道
3697,梅溪街道办,112.525543,32.994068,梅溪街道办,南阳市,河南省,1,河南省南阳市卧龙区梅溪街道办
3698,,112.498726,32.983124,武侯街道,南阳市,河南省,1,河南省南阳市卧龙区武侯街道
3699,,112.599747,33.116718,蒲山镇,南阳市,河南省,2,河南省南阳市卧龙区蒲山镇
3700,,112.448708,32.83622,陆营镇,南阳市,河南省,1,河南省南阳市卧龙区陆营镇
3701,,112.51812,33.017509,光武街道,南阳市,河南省,1,河南省南阳市卧龙区光武街道
3702,,112.449333,32.769939,英庄镇,南阳市,河南省,1,河南省南阳市卧龙区英庄镇
3703,,112.563271,33.029228,两相路,南阳市,河南省,1,河南省南阳市高新区两相路
3704,,112.563271,33.029228,北京路,南阳市,河南省,2,河南省南阳市高新区北京路
3705,,112.579201,32.941204,中关村,南阳市,河南省,1,河南省南阳市高新区中关村
3706,,112.650459,33.078609,新店乡,南阳市,河南省,1,河南省南阳市城乡一体化示范区新店乡
3707,,111.939552,33.037842,灌涨镇,南阳市,河南省,2,河南省南阳市内乡县灌涨镇
3708,,112.7099,34.578239,大口镇,洛阳市,河南省,1,河南省洛阳市偃师市大口镇
3709,金梨苑小区,112.431915,34.678677,金梨苑小区,洛阳市,河南省,1,河南省洛阳市西工区金梨苑小区
3710,新生村,112.46907,34.679771,新生村,洛阳市,河南省,1,河南省洛阳市老城区新生村
3711,南关市环保局家属院,112.465309,34.673397,南关市环保局家属院,洛阳市,河南省,1,河南省洛阳市老城区南关市环保局家属院
3712,升龙城,112.419807,34.644859,升龙城,洛阳市,河南省,1,河南省洛阳市涧西区升龙城
3713,洛热社区,112.384926,34.664364,洛热社区,洛阳市,河南省,1,河南省洛阳市涧西区洛热社区
3714,广州市场西院,112.392097,34.661362,广州市场西院,洛阳市,河南省,1,河南省洛阳市涧西区湖北路街道广州市场西院
3715,,112.411636,34.632381,滨河新村,洛阳市,河南省,2,河南省洛阳市高新区滨河新村
3716,惠安小区,112.139412,34.733952,惠安小区,洛阳市,河南省,1,河南省洛阳市新安县惠安小区
3717,四通路2号院,112.516342,34.720005,四通路2号院,洛阳市,河南省,2,河南省洛阳市瀍河区四通路2号院
3718,龙源花园,112.481308,34.701889,龙源花园,洛阳市,河南省,1,河南省洛阳市瀍河区龙源花园
3719,银河小区,112.521385,34.722393,银河小区,洛阳市,河南省,1,河南省洛阳市瀍河区杨文街道银河小区
3720,建业高尔夫,112.433823,34.63332,建业高尔夫,洛阳市,河南省,1,河南省洛阳市洛龙区建业高尔夫
3721,凯旋国际,113.298302,33.716759,凯旋国际,平顶山,河南省,1,河南省平顶山湛河区南环路街道凯旋国际
3722,,113.509972,33.529148,辛楼村,平顶山市,河南省,1,河南省平顶山市叶县仙台镇辛楼村
3723,,113.377533,33.59169,小河赵村,平顶山市,河南省,1,河南省平顶山市叶县马庄回族乡小河赵村
3724,光明路街道王庄村,113.292953,33.738972,光明路街道王庄村,平顶山市,河南省,1,河南省平顶山市新华区光明路街道王庄村
3725,嘉怡居,113.283699,33.737728,嘉怡居,平顶山市,河南省,1,河南省平顶山市新华区曙光街街道嘉怡居
3726,新华区政府家属院,113.281799,33.73885,新华区政府家属院,平顶山市,河南省,1,河南省平顶山市新华区曙光街街道新华区政府家属院
3727,阳光花苑小区,113.285278,33.74498,阳光花苑小区,平顶山市,河南省,2,河南省平顶山市新华区曙光街街道阳光花苑小区
3728,乐福小区,113.297211,33.75629,乐福小区,平顶山市,河南省,1,河南省平顶山市新华区矿工路街道乐福小区
3729,平安家园,113.301437,33.753227,平安家园,平顶山市,河南省,2,河南省平顶山市新华区矿工路街道平安家园
3730,西市场优胜花园,113.275833,33.757206,西市场优胜花园,平顶山市,河南省,2,河南省平顶山市新华区西市场优胜花园
3731,三环佳苑,113.279663,33.75391,三环佳苑,平顶山市,河南省,1,河南省平顶山市新华区西市场街道三七街三环佳苑
3732,五星小区,113.283363,33.75581,五星小区,平顶山市,河南省,1,河南省平顶山市新华区西市场街道五星小区
3733,优胜街四矿小区,113.27565,33.756329,优胜街四矿小区,平顶山市,河南省,1,河南省平顶山市新华区西市场街道优胜街四矿小区
3734,自然城小区,113.273193,33.757931,自然城小区,平顶山市,河南省,1,河南省平顶山市新华区西市场街道自然城小区
3735,南团小区,113.284752,33.752232,南团小区,平顶山市,河南省,1,河南省平顶山市新华区西市场街道三七街南团小区
3736,百合金山1号楼,113.27538,33.75779,百合金山1号楼,平顶山市,河南省,1,河南省平顶山市新华区西市场街道百合金山1号楼
3737,自然天城1号楼,113.273193,33.757931,自然天城1号楼,平顶山市,河南省,1,河南省平顶山市新华区西市场街道自然天城1号楼
3738,怡购城,113.281105,33.741173,怡购城,平顶山市,河南省,1,河南省平顶山市新华区西高皇街道怡购城
3739,西花园小区,113.234474,33.788914,西花园小区,平顶山市,河南省,1,河南省平顶山市新华区新新街街道西花园小区
3740,四矿矿后平房,113.273277,33.779629,四矿矿后平房,平顶山市,河南省,2,河南省平顶山市新华区西市场街道四矿矿后平房
3741,春华国际,113.258881,33.74382,春华国际,平顶山市,河南省,1,河南省平顶山市新华区西高皇街道春华国际
3742,常绿大阅城,113.182716,33.777222,常绿大阅城,平顶山市,河南省,1,河南省平顶山市新城区湖滨路街道常绿大阅城
3743,湖光花园凤舞园,113.183617,33.768021,湖光花园凤舞园,平顶山市,河南省,1,河南省平顶山市新城区湖滨路街道湖光花园凤舞园
3744,湖滨路街道西太平,113.176773,33.768101,湖滨路街道西太平,平顶山市,河南省,1,河南省平顶山市新城区湖滨路街道西太平
3745,,112.694908,34.082569,北周庄村,平顶山市,河南省,1,河南省平顶山市汝州市寄料镇北周庄村
3746,优越路佳田B座,113.309692,33.736568,优越路佳田B座,平顶山市,河南省,1,河南省平顶山市卫东区优越路佳田B座
3747,园丁路食品公司家属院,113.303131,33.723118,园丁路食品公司家属院,平顶山市,河南省,1,河南省平顶山市卫东区优越路街道园丁路食品公司家属院
3748,建设路街道佳田B楼,113.309692,33.736568,建设路街道佳田B楼,平顶山市,河南省,3,河南省平顶山市卫东区建设路街道佳田B楼
3749,广厦综合楼,113.314301,33.742599,广厦综合楼,平顶山市,河南省,1,河南省平顶山市卫东区优越路街道广厦综合楼
3750,,113.159088,33.91729,石桥镇,平顶山市,河南省,1,河南省平顶山市宝丰县石桥镇
3751,,113.145081,33.873989,孙庄村,平顶山市,河南省,1,河南省平顶山市宝丰县周庄镇孙庄村
3752,,112.912209,33.739281,老城大街,平顶山市,河南省,1,河南省平顶山市鲁山县老城大街
3753,直管4号院,112.392448,33.749191,直管4号院,平顶山市,河南省,1,河南省平顶山市鲁山县尧山镇直管4号院
3754,人民路中段172号院,112.904381,33.739063,人民路中段172号院,平顶山市,河南省,1,河南省平顶山市鲁山县鲁阳街道人民路中段172号院
3755,,114.176735,35.892529,红旗街道,鹤壁市,河南省,1,河南省鹤壁市山城区红旗街道
3756,,114.316032,34.766579,南苑街道,开封市,河南省,1,河南省开封市鼓楼区南苑街道
3757,牛墩村,114.315308,34.74926,牛墩村,开封市,河南省,1,河南省开封市鼓楼区南苑街道牛墩村
3758,王高自然村,115.141472,34.934818,王高自然村,开封市,河南省,1,河南省开封市兰考县南彰镇翟庄村王高自然村
3759,城北香阁小区,114.821365,34.835896,城北香阁小区,开封市,河南省,1,河南省开封市兰考县城北香阁小区
3760,城西班牙小镇2期,114.8088,34.840672,城西班牙小镇2期,开封市,河南省,1,河南省开封市兰考县城西班牙小镇2期
3761,,115.045021,34.908352,张庄寨村,开封市,河南省,1,河南省开封市兰考县小宋镇张庄寨村
3762,,114.888557,34.947071,谷西村,开封市,河南省,1,河南省开封市兰考县谷营镇谷西村
3763,建丰新城小区,114.378998,34.823738,建丰新城小区,开封市,河南省,2,河南省开封市龙亭区北郊乡建丰新城小区
3764,,114.210503,34.290531,南曹乡,开封市,河南省,1,河南省开封市尉氏县南曹乡
3765,,114.191757,34.29623,南曹乡后孙村,开封市,河南省,2,河南省开封市尉氏县南曹乡后孙村
3766,北曹村南头,114.204208,34.315849,北曹村南头,开封市,河南省,1,河南省开封市尉氏县南曹乡北曹村南头
3767,,114.204208,34.315849,南曹乡北曹村,开封市,河南省,1,河南省开封市尉氏县南曹乡北曹村
3768,UK中心小区,114.180847,34.394531,UK中心小区,开封市,河南省,1,河南省开封市尉氏县城关镇UK中心小区
3769,,114.755257,34.454288,滩上村,开封市,河南省,2,河南省开封市杞县苏木乡滩上村
3770,西关下关新村,114.775307,34.55611,西关下关新村,开封市,河南省,2,河南省开封市杞县金城街道西关下关新村
3771,,114.747093,34.238831,竹林乡许村岗村,开封市,河南省,1,河南省开封市杞县竹林乡许村岗村
3772,,114.880379,34.548439,裴村店乡吕西村,开封市,河南省,1,河南省开封市杞县裴村店乡吕西村
3773,县委西二巷,114.46524,34.48045,县委西二巷,开封市,河南省,1,河南省开封市通许县县委西二巷
3774,,114.491447,34.407871,张斗庄村,开封市,河南省,1,河南省开封市通许县邸阁乡张斗庄村
3775,,114.480438,34.387562,厉庄乡塔湾村委杨庄村,开封市,河南省,1,河南省开封市通许县厉庄乡塔湾村委杨庄村
3776,,114.639069,34.386471,夏寨大队汤庄村,开封市,河南省,1,河南省开封市通许县四所楼镇夏寨大队汤庄村
3777,,115.121178,34.61977,南华街道东区,商丘市,河南省,1,河南省商丘市民权县南华街道东区
3778,花园吴老家,115.114098,34.597919,花园吴老家,商丘市,河南省,1,河南省商丘市民权县花园吴老家
3779,,115.591751,34.521389,潘口南街村,商丘市,河南省,1,河南省商丘市梁园区李庄乡潘口南街村
3780,豫立首府,115.669891,34.44479,豫立首府,商丘市,河南省,6,河南省商丘市梁园区东风街道豫立首府
3781,,115.728828,34.57975,中陈村,商丘市,河南省,1,河南省商丘市梁园区刘口乡中陈村
3782,,115.736122,34.557991,中陈村王庄,商丘市,河南省,1,河南省商丘市梁园区刘口乡中陈村王庄
3783,一建公司家属院,115.648529,34.431179,一建公司家属院,商丘市,河南省,1,河南省商丘市梁园区前进街道一建公司家属院
3784,,115.507431,34.58046,张庄村,商丘市,河南省,1,河南省商丘市梁园区孙付集乡张庄村
3785,昆仑路八一新苑,115.612617,34.432838,昆仑路八一新苑,商丘市,河南省,1,河南省商丘市梁园区平原街道昆仑路八一新苑
3786,,115.530251,34.365631,沈庄,商丘市,河南省,1,河南省商丘市梁园区沈庄
3787,,115.665237,34.435669,叶庄南新村,商丘市,河南省,1,河南省商丘市梁园区白云办事处叶庄南新村
3788,酒厂路叶庄村,115.666977,34.439362,酒厂路叶庄村,商丘市,河南省,1,河南省商丘市梁园区白云街道酒厂路叶庄村
3789,牡丹小区,115.683128,34.415298,牡丹小区,商丘市,河南省,1,河南省商丘市永城市新城区牡丹小区
3790,永鑫园东区,116.372162,33.949257,永鑫园东区,商丘市,河南省,1,河南省商丘市永城市永鑫园东区
3791,天齐村西刘店组,116.418549,33.980671,天齐村西刘店组,商丘市,河南省,1,河南省商丘市永城市演集镇天齐村西刘店组
3792,闫各村,116.095963,33.94381,闫各村,商丘市,河南省,1,河南省商丘市永城市酂城镇夏柏园村闫各村
3793,粮管所家属院,116.220551,33.800152,粮管所家属院,商丘市,河南省,3,河南省商丘市永城市马桥镇粮管所家属院
3794,,116.196121,33.787029,闫庙村,商丘市,河南省,1,河南省商丘市永城市马桥镇闫庙村
3795,,116.192207,33.798988,马庄村,商丘市,河南省,4,河南省商丘市永城市马桥镇马庄村
3796,发展广场,116.452522,33.929916,发展广场,商丘市,河南省,1,河南省商丘市永城市发展广场
3797,岚湾国际小区,116.446121,33.937881,岚湾国际小区,商丘市,河南省,1,河南省商丘市永城市东城区岚湾国际小区
3798,,116.418549,33.980671,天齐村,商丘市,河南省,1,河南省商丘市永城市演集乡天齐村
3799,杨堂新村,115.671761,34.45052,杨堂新村,商丘市,河南省,2,河南省商丘市示范区中州街道杨堂新村
3800,黄楼东村,115.688599,34.44442,黄楼东村,商丘市,河南省,1,河南省商丘市示范区中州街道黄楼东村
3801,富贵华庭,115.666451,34.402908,富贵华庭,商丘市,河南省,2,河南省商丘市示范区平安街道富贵华庭
3802,,115.75502,34.453529,孙集村,商丘市,河南省,1,河南省商丘市示范区张阁镇孙集村
3803,,115.829277,34.449589,高庄村,商丘市,河南省,1,河南省商丘市虞城县李老家乡高庄村
3804,木兰大道木兰小区,115.846718,34.39246,木兰大道木兰小区,商丘市,河南省,1,河南省商丘市虞城县城关镇木兰大道木兰小区
3805,,115.730209,34.206669,魏楼村,商丘市,河南省,1,河南省商丘市虞城县店集乡魏楼村
3806,,116.08107,34.098511,会亭镇杜庄,商丘市,河南省,1,河南省商丘市夏邑县会亭镇杜庄
3807,,116.12969,34.23929,城关一环路骆集路口,商丘市,河南省,1,河南省商丘市夏邑县城关一环路骆集路口
3808,,116.132011,34.23341,闫刘庄村,商丘市,河南省,1,河南省商丘市夏邑县城关镇闫刘庄村
3809,,116.186462,34.216148,许庄,商丘市,河南省,2,河南省商丘市夏邑县曹集乡许庄
3810,,115.995491,34.03231,杨集高庄,商丘市,河南省,1,河南省商丘市夏邑县杨集高庄
3811,,115.980667,34.12175,李营村周楼,商丘市,河南省,1,河南省商丘市夏邑县罗庄乡李营村周楼
3812,,116.012497,34.40678,良种厂村,商丘市,河南省,1,河南省商丘市夏邑县车站镇良种厂村
3813,,116.083549,34.139889,金庄村,商丘市,河南省,1,河南省商丘市夏邑县郭店乡金庄村
3814,,116.08107,34.098511,会亭镇,商丘市,河南省,1,河南省商丘市夏邑县会亭镇
3815,,115.146278,34.437401,潘庄村,商丘市,河南省,1,河南省商丘市睢县尤吉屯乡潘庄村
3816,吴庄,115.30544,34.09114,吴庄,商丘市,河南省,1,河南省商丘市柘城县双河办事处吴庄
3817,,115.150841,34.004002,张店村委大史庄,商丘市,河南省,1,河南省商丘市柘城县安平镇张店村委大史庄
3818,,115.206718,34.099659,天门赵村,商丘市,河南省,2,河南省商丘市柘城县岗王乡天门赵村
3819,,115.292061,34.036812,张桥镇张桥,商丘市,河南省,1,河南省商丘市柘城县张桥镇张桥
3820,德育巷,115.319923,34.091404,德育巷,商丘市,河南省,1,河南省商丘市柘城县春水办事处德育巷
3821,兴中道,115.333069,34.082581,兴中道,商丘市,河南省,1,河南省商丘市柘城县春水街道办事处兴中道
3822,,115.133499,34.101929,刘楼小朱庄,商丘市,河南省,1,河南省商丘市柘城县申桥乡刘楼小朱庄
3823,,115.228683,34.028542,后李,商丘市,河南省,1,河南省商丘市柘城县皇集乡后李
3824,,115.298103,34.071312,德育巷,商丘市,河南省,1,河南省商丘市柘城县城关镇德育巷
3825,,115.2948,34.035912,张桥村,商丘市,河南省,1,河南省商丘市柘城县张桥镇张桥村
3826,,115.143669,34.000549,凤凰街道,商丘市,河南省,1,河南省商丘市柘城县凤凰街道
3827,,115.30265,34.037746,张桥镇,商丘市,河南省,1,河南省商丘市柘城县张桥镇
3828,,115.333069,34.082581,春水街道办事处,商丘市,河南省,2,河南省商丘市柘城县春水街道办事处
3829,学苑小区,115.323914,34.085991,学苑小区,商丘市,河南省,1,河南省商丘市柘城县浦东街道办事处学苑小区
3830,,115.404022,34.585815,宋胡同村,商丘市,河南省,2,河南省商丘市宁陵县孔集乡宋胡同村
3831,,115.258438,34.309231,温庙村,商丘市,河南省,1,河南省商丘市宁陵县华堡镇温庙村
3832,,115.316597,34.50425,王坡楼村,商丘市,河南省,2,河南省商丘市宁陵县石桥镇王坡楼村
3833,,115.277557,34.393211,胡店村,商丘市,河南省,1,河南省商丘市宁陵县刘楼乡胡店村
3834,,115.273422,34.47023,郭英村,商丘市,河南省,1,河南省商丘市宁陵县城郊乡郭英村
3835,,115.404091,34.585621,宋胡洞东村,商丘市,河南省,1,河南省商丘市宁陵县孔集乡宋胡洞东村
3836,,115.549362,34.097359,包公庙乡十西村,商丘市,河南省,2,河南省商丘市睢阳区包公庙乡十西村
3837,宇鑫小区,115.660042,34.408489,宇鑫小区,商丘市,河南省,1,河南省商丘市睢阳区南京路与归德路交叉口宇鑫小区
3838,名门城书苑花园,115.648331,34.375671,名门城书苑花园,商丘市,河南省,1,河南省商丘市睢阳区古宋街道名门城书苑花园
3839,振华南苑小区,115.608467,34.348713,振华南苑小区,商丘市,河南省,1,河南省商丘市睢阳区振华南苑小区
3840,长江路与开元路交叉口南,115.661461,34.413021,长江路与开元路交叉口南,商丘市,河南省,1,河南省商丘市睢阳区长江路与开元路交叉口南
3841,,115.587868,34.375938,古宋办事处常路口村,商丘市,河南省,1,河南省商丘市睢阳区古宋办事处常路口村
3842,,115.643532,34.40929,宏昌路附近,商丘市,河南省,1,河南省商丘市睢阳区东方办事处宏昌路附近
3843,,113.745033,35.67054,南村镇,新乡市,河南省,1,河南省新乡市辉县市南村镇
3844,,113.739967,35.432079,北云门镇,新乡市,河南省,1,河南省新乡市辉县市北云门镇
3845,,113.739594,35.674561,尚庄村,新乡市,河南省,1,河南省新乡市辉县市南村镇尚庄村
3846,,113.824387,35.454166,滨河湾小区,新乡市,河南省,3,河南省新乡市辉县市城关镇滨河湾小区
3847,世纪清华小区,113.791527,35.451698,世纪清华小区,新乡市,河南省,1,河南省新乡市辉县市世纪清华小区
3848,富春园小区A区,113.8954,35.2771,富春园小区A区,新乡市,河南省,1,河南省新乡市红旗区振中街250号富春园小区A区
3849,,113.929047,35.275532,洪门镇,新乡市,河南省,1,河南省新乡市红旗区洪门镇
3850,,113.796181,35.197769,新乡经济开发区闫庄村,新乡市,河南省,2,河南省新乡市新乡县新乡经济开发区闫庄村
3851,,113.887459,35.169258,东荆楼村,新乡市,河南省,1,河南省新乡市新乡县朗公庙镇东荆楼村
3852,,113.881012,35.209961,张湾村,新乡市,河南省,1,河南省新乡市新乡县朗公庙镇张湾村
3853,,113.899239,35.224266,青龙路东段,新乡市,河南省,1,河南省新乡市新乡县青龙路东段
3854,,114.868698,35.33075,佘西村,新乡市,河南省,1,河南省新乡市长垣市佘家镇佘西村
3855,,114.66156,35.145748,南蒲街道办事处,新乡市,河南省,1,河南省新乡市长垣市南蒲街道办事处
3856,,114.764381,35.241459,小吕村,新乡市,河南省,1,河南省新乡市长垣市满村镇小吕村
3857,,114.731216,35.255959,满村镇,新乡市,河南省,1,河南省新乡市长垣市满村镇
